{
  "explored_directions": [],
  "pruned_features": [],
  "decision_log": [
    {
      "layer": "mvp",
      "action": "APPROVE",
      "detail": "Approved 8 MVP features (F1-F8): skill dedup, mode detection subagent, L1 research subagent, L3 generation subagent, artifact writing subagent, Stitch MCP subagent, dispatch contract standard, context budget guard. Design philosophy: main-agent-as-router, subagent-gets-full-context, fail-loud-user-decides.",
      "timestamp": "2026-04-07T12:00:00Z"
    },
    {
      "layer": "lock",
      "action": "APPROVE",
      "detail": "Approved 11 requirements (REQ-001~011), 3 invariants (INV-001~003), 3 scenarios. All challenges ACCEPT_COST: multi-round REVISE re-dispatch latency, MCP inheritance in subagent, cross-platform testing.",
      "timestamp": "2026-04-07T12:30:00Z"
    }
  ],
  "completeness_snapshots": [
    {
      "layer": "2",
      "dimensions": {
        "core_feature_definition": 95,
        "user_scenario_coverage": 80,
        "technical_constraints": 90,
        "boundary_conditions": 70,
        "non_functional_requirements": 80
      },
      "gaps_noted": ["subagent timeout/failure fallback strategy undefined"],
      "timestamp": "2026-04-07T12:00:00Z"
    },
    {
      "layer": "3",
      "dimensions": {
        "core_feature_definition": 100,
        "user_scenario_coverage": 90,
        "technical_constraints": 90,
        "boundary_conditions": 85,
        "non_functional_requirements": 90
      },
      "gaps_noted": [],
      "timestamp": "2026-04-07T12:30:00Z"
    }
  ]
}
